{
  "$schema": "https://json-schema.org/draft/2020-12/schema",
  "$id": "keryx/shared-agent-context/access-receipt/v1",
  "$vocabulary": {"https://json-schema.org/draft/2020-12/vocab/format-assertion": true},
  "type": "object",
  "additionalProperties": false,
  "required": ["schemaVersion", "id", "workspaceId", "actor", "action", "decision", "recordedAt", "cost", "contextAssembly", "policy", "integrity"],
  "properties": {
    "schemaVersion": {"const": "1.0"}, "id": {"type": "string", "pattern": "^[a-z][a-z0-9-]{2,63}$"}, "workspaceId": {"type": "string", "pattern": "^[a-z][a-z0-9-]{2,63}$"}, "actor": {"type": "string", "pattern": "^(?:user|team|service|agent):[a-z0-9][a-z0-9._-]{0,127}$"}, "action": {"enum": ["overview", "fwk", "resource"]}, "decision": {"enum": ["allowed", "denied", "budget-exhausted", "stale"]}, "recordedAt": {"$ref": "#/$defs/utcTimestamp"}, "cost": {"type": "object", "additionalProperties": false, "required": ["toolCalls", "elapsedMs"], "properties": {"tokens": {"type": "integer", "minimum": 0}, "toolCalls": {"type": "integer", "minimum": 0}, "elapsedMs": {"type": "integer", "minimum": 0}}}, "contextAssembly": {"type": "object", "additionalProperties": false, "required": ["traceRef", "configurationRevision", "selected", "omittedOptional"], "properties": {"traceRef": {"$ref": "#/$defs/workspacePath"}, "configurationRevision": {"$ref": "#/$defs/revision"}, "selected": {"type": "array", "items": {"$ref": "#/$defs/workspacePath"}}, "omittedOptional": {"type": "array", "items": {"$ref": "#/$defs/workspacePath"}}}}, "policy": {"type": "object", "additionalProperties": false, "required": ["ref", "revision"], "properties": {"ref": {"$ref": "#/$defs/workspacePath"}, "revision": {"$ref": "#/$defs/revision"}}}, "integrity": {"type": "object", "additionalProperties": false, "required": ["recordHash", "previousRecordHash"], "properties": {"recordHash": {"type": "string", "pattern": "^[a-f0-9]{64}$"}, "previousRecordHash": {"type": "string", "pattern": "^(?:[a-f0-9]{64}|GENESIS)$"}}}, "resourceRef": {"$ref": "#/$defs/workspacePath"}, "outcome": {"enum": ["unknown", "useful", "not-useful"]}},
  "allOf": [{"if": {"properties": {"action": {"const": "resource"}}, "required": ["action"]}, "then": {"required": ["resourceRef"]}, "else": {"not": {"required": ["resourceRef"]}}}],
  "x-rootContainment": {"fields": ["resourceRef", "contextAssembly.traceRef", "contextAssembly.selected[]", "contextAssembly.omittedOptional[]", "policy.ref"], "root": "workspace root", "resolveSymlinks": true, "rejectEscapes": true}, "x-integrity": {"appendOnlyLedger": true, "verifyRecordHash": true, "owner": "trusted local service"},
  "$defs": {"utcTimestamp": {"type": "string", "format": "date-time", "pattern": "^[0-9]{4}-[0-9]{2}-[0-9]{2}T[0-9]{2}:[0-9]{2}:[0-9]{2}(?:\\.[0-9]+)?Z$", "x-formatAssertionRequired": true}, "revision": {"type": "string", "minLength": 1, "maxLength": 256, "pattern": "^[A-Za-z0-9][A-Za-z0-9._:-]{0,255}$", "x-immutable": true}, "workspacePath": {"type": "string", "pattern": "^\\./(?!.*(?:^|/)\\.\\.(?:/|$))(?:[A-Za-z0-9._-]+/)*[A-Za-z0-9._-]+$"}}
}
