{"schemaVersion":"1.0","id":"access-1","workspaceId":"payments-work","actor":"agent:release-bot","action":"resource","decision":"allowed","recordedAt":"2026-08-11T00:05:00Z","cost":{"toolCalls":1,"elapsedMs":12},"contextAssembly":{"traceRef":"./context/trace-1","configurationRevision":"1","selected":["./src/payments"],"omittedOptional":[]},"policy":{"ref":"./policies/default","revision":"1"},"integrity":{"recordHash":"aaaaaaaaaaaaaaaaaaaaaaaaaaaaaaaaaaaaaaaaaaaaaaaaaaaaaaaaaaaaaaaa","previousRecordHash":"GENESIS"},"resourceRef":"./src/payments"}
